{"$schema":"../../../../schemas/control-pilot.schema.json","schema_version":"1.0.0","pilot_id":"abk:pilot:control-bounded-v1","campaign_id":"abk:benchmark-campaign:artifact-dag-core-v1","branch":"control","captured_at":"2026-08-04T20:14:18Z","status":"passed","full_campaign":false,"raw_runs":10,"expected_full_campaign_runs":66,"aligned_cases":6,"divergent_cases":4,"campaign_sha256":"471b4f31608781205ce71d497add92d15659003a2a5852f1cc7fb59330b320d3","schema_sha256":"b4cacc60fe730faab91595f3f00b73ddf8729b494413a5eab5fa295e494b8aff","control_manifest_sha256":"5c041ba5fe1621cf72ac2091cef7358875789c38cbc1115fe6b1d15891c9a235","entrypoint_sha256":"a0e4929d124c831035546c8c65a1de7618da789d05a4bb24b645285421e859c1","pilot_schema_sha256":"4934b6fda3b90565c7f030fa8c6a66043ebb9df68704e824b2339eeec0748c76","results":[{"evidence_id":"control-bounded-pilot-com-01-normal-primary-r1","case_id":"COM-01-normal-primary","status":"passed","expected_terminal_state":"SUCCEEDED","observed_terminal_state":"SUCCEEDED","expected_exit_code":0,"observed_exit_code":0,"expected_error_code":null,"observed_error_code":null,"expected_recovery":false,"observed_recovery":false,"expected_handoff":false,"observed_handoff":false,"evaluation":"aligned","oracle_status":"passed","run_relative_path":"benchmarks/campaigns/artifact-dag-core-v1/runs/control-bounded-pilot-20260804/COM-01-normal-primary/control/R1/run.json","run_sha256":"4af4a1ec4362cd89fa25ea3eb50637c28ab298905470bae08f10a07e7eaccec9","oracle_relative_path":"benchmarks/campaigns/artifact-dag-core-v1/runs/control-bounded-pilot-20260804/COM-01-normal-primary/control/R1/oracle-result.json","oracle_sha256":"d1aa6906bf089ffd3bc6b213fe31dc778e251a2c22714dfeb3047cb3b35e9647"},{"evidence_id":"control-bounded-pilot-com-02-normal-variant-r1","case_id":"COM-02-normal-variant","status":"passed","expected_terminal_state":"SUCCEEDED","observed_terminal_state":"SUCCEEDED","expected_exit_code":0,"observed_exit_code":0,"expected_error_code":null,"observed_error_code":null,"expected_recovery":false,"observed_recovery":false,"expected_handoff":false,"observed_handoff":false,"evaluation":"aligned","oracle_status":"passed","run_relative_path":"benchmarks/campaigns/artifact-dag-core-v1/runs/control-bounded-pilot-20260804/COM-02-normal-variant/control/R1/run.json","run_sha256":"03d4fc80b5588603ce5a923b22126ccb09d00cc9bbba42a905f52cdb2c679e30","oracle_relative_path":"benchmarks/campaigns/artifact-dag-core-v1/runs/control-bounded-pilot-20260804/COM-02-normal-variant/control/R1/oracle-result.json","oracle_sha256":"9fb22b0296c1a443c9523635e6eef6ca374bea9f83f9e3127ba2e38ea06294d8"},{"evidence_id":"control-bounded-pilot-com-03-normal-repeat-r1","case_id":"COM-03-normal-repeat","status":"passed","expected_terminal_state":"SUCCEEDED","observed_terminal_state":"SUCCEEDED","expected_exit_code":0,"observed_exit_code":0,"expected_error_code":null,"observed_error_code":null,"expected_recovery":false,"observed_recovery":false,"expected_handoff":false,"observed_handoff":false,"evaluation":"aligned","oracle_status":"passed","run_relative_path":"benchmarks/campaigns/artifact-dag-core-v1/runs/control-bounded-pilot-20260804/COM-03-normal-repeat/control/R1/run.json","run_sha256":"9c750aee2350dd03cf65fea6d6b72923e5f812dfe15e39d4bfc11f9b3bfeb06b","oracle_relative_path":"benchmarks/campaigns/artifact-dag-core-v1/runs/control-bounded-pilot-20260804/COM-03-normal-repeat/control/R1/oracle-result.json","oracle_sha256":"55fe10b7dbfcdae652e5575c151b8be4795de84dece667294c610e6bd41d4f01"},{"evidence_id":"control-bounded-pilot-com-04-boundary-minimum-r1","case_id":"COM-04-boundary-minimum","status":"passed","expected_terminal_state":"SUCCEEDED","observed_terminal_state":"SUCCEEDED","expected_exit_code":0,"observed_exit_code":0,"expected_error_code":null,"observed_error_code":null,"expected_recovery":false,"observed_recovery":false,"expected_handoff":false,"observed_handoff":false,"evaluation":"aligned","oracle_status":"passed","run_relative_path":"benchmarks/campaigns/artifact-dag-core-v1/runs/control-bounded-pilot-20260804/COM-04-boundary-minimum/control/R1/run.json","run_sha256":"dd6a24bbe25c495d76ede99e0b48795e7d5a8cbacd5a59b7e49a97c5d83b410f","oracle_relative_path":"benchmarks/campaigns/artifact-dag-core-v1/runs/control-bounded-pilot-20260804/COM-04-boundary-minimum/control/R1/oracle-result.json","oracle_sha256":"07dbf4f1159b95628111eb9b7cb64ceae3606148a1bb3878d8fae8dbfa561df8"},{"evidence_id":"control-bounded-pilot-com-05-invalid-input-r1","case_id":"COM-05-invalid-input","status":"passed","expected_terminal_state":"FAILED","observed_terminal_state":"FAILED","expected_exit_code":3,"observed_exit_code":3,"expected_error_code":"UNKNOWN_ARTIFACT_REFERENCE","observed_error_code":"UNKNOWN_ARTIFACT_REFERENCE","expected_recovery":false,"observed_recovery":false,"expected_handoff":false,"observed_handoff":false,"evaluation":"aligned","oracle_status":"passed","run_relative_path":"benchmarks/campaigns/artifact-dag-core-v1/runs/control-bounded-pilot-20260804/COM-05-invalid-input/control/R1/run.json","run_sha256":"e5a02c5f2c6433ee282d641ddc0129683d26e4067146af5b9f5dc1265ba6e25e","oracle_relative_path":"benchmarks/campaigns/artifact-dag-core-v1/runs/control-bounded-pilot-20260804/COM-05-invalid-input/control/R1/oracle-result.json","oracle_sha256":"875a3dbcd9496b5d1eeedea47fe535230c21d0545a23cb7948548ed44d156a51"},{"evidence_id":"control-bounded-pilot-com-06-stop-interrupt-r1","case_id":"COM-06-stop-interrupt","status":"passed","expected_terminal_state":"STOPPED","observed_terminal_state":"SUCCEEDED","expected_exit_code":130,"observed_exit_code":0,"expected_error_code":"INTERRUPTED","observed_error_code":null,"expected_recovery":false,"observed_recovery":false,"expected_handoff":false,"observed_handoff":false,"evaluation":"divergent","oracle_status":"inconclusive","run_relative_path":"benchmarks/campaigns/artifact-dag-core-v1/runs/control-bounded-pilot-20260804/COM-06-stop-interrupt/control/R1/run.json","run_sha256":"8d1270a584e7e86b186d55aaee8c3d3933aaee3ef9d9d7f76dad1b6e6cb1cb09","oracle_relative_path":"benchmarks/campaigns/artifact-dag-core-v1/runs/control-bounded-pilot-20260804/COM-06-stop-interrupt/control/R1/oracle-result.json","oracle_sha256":"c8cf17c3b0cb6a30d39ffa6cb69f0ed742dbf8acca377834cb808a747e1a41ef"},{"evidence_id":"control-bounded-pilot-spc-01-domain-boundary-r1","case_id":"SPC-01-domain-boundary","status":"passed","expected_terminal_state":"REJECTED","observed_terminal_state":"FAILED","expected_exit_code":2,"observed_exit_code":3,"expected_error_code":"DEPENDENCY_OUT_OF_ROOT","observed_error_code":"UNKNOWN_ARTIFACT_REFERENCE","expected_recovery":false,"observed_recovery":false,"expected_handoff":false,"observed_handoff":false,"evaluation":"divergent","oracle_status":"inconclusive","run_relative_path":"benchmarks/campaigns/artifact-dag-core-v1/runs/control-bounded-pilot-20260804/SPC-01-domain-boundary/control/R1/run.json","run_sha256":"1de53001964a7a94fab75c13198436a9c141cbc385e949ca14b86bd1f7a8407e","oracle_relative_path":"benchmarks/campaigns/artifact-dag-core-v1/runs/control-bounded-pilot-20260804/SPC-01-domain-boundary/control/R1/oracle-result.json","oracle_sha256":"f2bc968c3ab68565f70f9389acd78b1db6f1330da3d5d86d8075ec3fe19b660e"},{"evidence_id":"control-bounded-pilot-spc-02-failure-path-r1","case_id":"SPC-02-failure-path","status":"passed","expected_terminal_state":"FAILED","observed_terminal_state":"FAILED","expected_exit_code":3,"observed_exit_code":3,"expected_error_code":"UNKNOWN_ARTIFACT_REFERENCE","observed_error_code":"UNKNOWN_ARTIFACT_REFERENCE","expected_recovery":false,"observed_recovery":false,"expected_handoff":false,"observed_handoff":false,"evaluation":"aligned","oracle_status":"passed","run_relative_path":"benchmarks/campaigns/artifact-dag-core-v1/runs/control-bounded-pilot-20260804/SPC-02-failure-path/control/R1/run.json","run_sha256":"afeaab6615911233213538bf7b136c09b806f3e83a316c4a6f9b090730c7d3f1","oracle_relative_path":"benchmarks/campaigns/artifact-dag-core-v1/runs/control-bounded-pilot-20260804/SPC-02-failure-path/control/R1/oracle-result.json","oracle_sha256":"884c0c150dfafa115eed3cc7c62d467e85e8c14298482db4f17e7610e8035ba7"},{"evidence_id":"control-bounded-pilot-spc-03-recovery-rollback-r1","case_id":"SPC-03-recovery-rollback","status":"passed","expected_terminal_state":"RECOVERED","observed_terminal_state":"SUCCEEDED","expected_exit_code":0,"observed_exit_code":0,"expected_error_code":"RECOVERED_AFTER_FAILURE","observed_error_code":null,"expected_recovery":true,"observed_recovery":false,"expected_handoff":false,"observed_handoff":false,"evaluation":"divergent","oracle_status":"inconclusive","run_relative_path":"benchmarks/campaigns/artifact-dag-core-v1/runs/control-bounded-pilot-20260804/SPC-03-recovery-rollback/control/R1/run.json","run_sha256":"8b142604c4b938e7e3c881f8d8b3b99f408093018922fae5a549497cd714ec1a","oracle_relative_path":"benchmarks/campaigns/artifact-dag-core-v1/runs/control-bounded-pilot-20260804/SPC-03-recovery-rollback/control/R1/oracle-result.json","oracle_sha256":"e8601650044900e1a89eba1f9e122f0cc7fbdb75a7862f2baf0687a260523e2d"},{"evidence_id":"control-bounded-pilot-spc-04-composition-handoff-r1","case_id":"SPC-04-composition-handoff","status":"passed","expected_terminal_state":"SUCCEEDED","observed_terminal_state":"SUCCEEDED","expected_exit_code":0,"observed_exit_code":0,"expected_error_code":null,"observed_error_code":null,"expected_recovery":false,"observed_recovery":false,"expected_handoff":true,"observed_handoff":false,"evaluation":"divergent","oracle_status":"inconclusive","run_relative_path":"benchmarks/campaigns/artifact-dag-core-v1/runs/control-bounded-pilot-20260804/SPC-04-composition-handoff/control/R1/run.json","run_sha256":"4092cc54133cae427b1699257c6c13229fd985be1a0e7cf7c4c127e260809acd","oracle_relative_path":"benchmarks/campaigns/artifact-dag-core-v1/runs/control-bounded-pilot-20260804/SPC-04-composition-handoff/control/R1/oracle-result.json","oracle_sha256":"4c8ac82b4d